{
  "run_date": "2026-04-02",
  "profile_name": "Staff+ SRE / Infrastructure",
  "mode": "dry-run",
  "lookback_days": 7,
  "theme": "terminal",
  "actions": [
    {
      "title": "Active Thread \u2014 Falcon LLM",
      "body": "Tom Sherwood (Falcon LLM team) replied twice today. Message 1 (9am): \"Of course, python is fine. Would you like me to re-book your live coding with Olivier?\" Message 2 (5pm): \"Just emailed you new booking link :-)\" \u2014 You have an unsent draft reply in Gmail asking for comp range and remote policy. Send or schedule it now.",
      "links": [
        {"label": "Open Gmail drafts", "url": "https://mail.google.com/mail/u/0/#drafts"},
        {"label": "View thread", "url": "https://mail.google.com/mail/u/0/#inbox/18e4f00000000001"}
      ]
    },
    {
      "title": "Awaiting Reply \u2014 Stripe (3 days)",
      "body": "Sent follow-up on 2026-03-30 asking about equity vesting and remote policy. No response yet.",
      "links": [
        {"label": "View thread", "url": "https://mail.google.com/mail/u/0/#inbox/18e4f00000000002"}
      ]
    }
  ],
  "results": [
    {
      "source": "Direct Outreach",
      "message_id": "18e4f00000000010",
      "thread_id": "18e4f00000000010",
      "subject": "Infrastructure Engineer opportunity at Anthropic",
      "from": "Sarah Chen <sarah@anthropic.com>",
      "email_date": "2026-04-01",
      "company": "Anthropic",
      "role": "Infrastructure Engineer, Sandboxing",
      "location": "Seattle, WA",
      "verdict": "pass",
      "reason": "Exact role match \u2014 Linux infra, sandboxing systems work at a leading AI company. Strong engineering reputation, well-funded. Seattle hybrid likely but remote sometimes available; confirm.",
      "dealbreaker": "",
      "comp_assessment": "Top-tier AI company comp. Expect $250k\u2013$350k TC range for Staff-level infra. Above target floor, equity likely substantial.",
      "missing_fields": ["Comp range", "Remote/hybrid policy", "Interview process"],
      "reply_draft": "Hi Sarah,\n\nThanks for reaching out \u2014 the sandboxing infrastructure work at Anthropic sounds like a strong fit.\n\nA few questions before we move forward:\n\n1. What\u2019s the total comp range for this role (base + equity)?\n2. What\u2019s the remote/hybrid policy for this position?\n3. Can you share an overview of the interview process?\n\nLooking forward to hearing more.\n\nBest,\nPaul",
      "draft_url": "https://mail.google.com/mail/u/0/#drafts?compose=18e4f00000000010",
      "posting_url": "https://boards.greenhouse.io/anthropic/jobs/12345",
      "email_url": "https://mail.google.com/mail/u/0/#inbox/18e4f00000000010",
      "sent": false
    },
    {
      "source": "Job Alert Listings",
      "message_id": "18e4f00000000011",
      "thread_id": "18e4f00000000011",
      "subject": "Senior Software Engineer, Systems at Anthropic",
      "from": "LinkedIn Job Alerts <jobalerts@linkedin.com>",
      "email_date": "2026-04-01",
      "company": "Anthropic",
      "role": "Senior Software Engineer, Systems",
      "location": "US",
      "verdict": "pass",
      "reason": "Systems engineering at a top-tier AI company. Role aligns with infrastructure background. Likely competitive comp.",
      "dealbreaker": "",
      "comp_assessment": "AI top-tier. Should clear floor easily at senior+ level.",
      "missing_fields": ["Comp range", "Remote/hybrid policy"],
      "reply_draft": "",
      "draft_url": "",
      "posting_url": "https://boards.greenhouse.io/anthropic/jobs/12346",
      "email_url": "https://mail.google.com/mail/u/0/#inbox/18e4f00000000011",
      "sent": false
    },
    {
      "source": "Direct Outreach",
      "message_id": "18e4f00000000012",
      "thread_id": "18e4f00000000012",
      "subject": "Google Cloud Observability - Staff SRE",
      "from": "Mike Torres <mtorres@google.com>",
      "email_date": "2026-03-31",
      "company": "Google",
      "role": "Senior Staff SRE, Cloud Observability",
      "location": "TBD \u2014 verify US vs EU",
      "verdict": "pass",
      "reason": "Staff SRE at Google Cloud \u2014 strong whitelist match. Observability is core SRE domain. Confirm location and hybrid expectations.",
      "dealbreaker": "",
      "comp_assessment": "Google L6/L7 SRE comp ranges $350k\u2013$500k+ TC. Well above target.",
      "missing_fields": ["Location details", "Remote/hybrid policy", "Team size"],
      "reply_draft": "Hi Mike,\n\nAppreciate you reaching out about the Cloud Observability SRE role \u2014 this is right in my wheelhouse.\n\nA few things I\u2019d like to understand:\n\n1. What locations is this role based in?\n2. What\u2019s the remote/hybrid policy?\n3. How large is the current team?\n\nThanks,\nPaul",
      "draft_url": "https://mail.google.com/mail/u/0/#drafts?compose=18e4f00000000012",
      "posting_url": "",
      "email_url": "https://mail.google.com/mail/u/0/#inbox/18e4f00000000012",
      "sent": false
    },
    {
      "source": "Job Alert Listings",
      "message_id": "18e4f00000000013",
      "thread_id": "18e4f00000000013",
      "subject": "AI Infrastructure / Platform Engineer at AMD",
      "from": "Indeed Job Alerts <jobalerts@indeed.com>",
      "email_date": "2026-03-31",
      "company": "AMD",
      "role": "AI Infrastructure / Platform Engineer \u2014 GPU Compute",
      "location": "US",
      "verdict": "pass",
      "reason": "AI infra platform work at a major chip company. Comp listed in range. Interesting GPU compute angle.",
      "dealbreaker": "",
      "comp_assessment": "$192k\u2013$288k listed. Floor at $225k falls within range \u2014 negotiable to target. Low end is tight but top end is above floor.",
      "missing_fields": ["Remote/hybrid policy", "TC (not just base)"],
      "reply_draft": "",
      "draft_url": "",
      "posting_url": "https://jobs.amd.com/ai-infra-12345",
      "email_url": "https://mail.google.com/mail/u/0/#inbox/18e4f00000000013",
      "sent": false
    },
    {
      "source": "Direct Outreach",
      "message_id": "18e4f00000000020",
      "thread_id": "18e4f00000000020",
      "subject": "Staff Software Engineer - Platform / Infrastructure at Redrecruit",
      "from": "Alex Kim <alex@redrecruit.io>",
      "email_date": "2026-04-01",
      "company": "Redrecruit",
      "role": "Staff Software Engineer \u2014 Platform / Infrastructure",
      "location": "New York, NY",
      "verdict": "maybe",
      "reason": "Staff-level platform/infra role. Comp starts at $225k \u2014 right at floor, top $285k above target base. Unknown company; vet funding and engineering reputation before applying.",
      "dealbreaker": "",
      "comp_assessment": "Comp starts at floor ($225k). $285k top is solid but not exceptional for Staff in NYC. Need to confirm TC includes equity.",
      "missing_fields": ["Company details/funding", "Remote/hybrid policy", "TC (not just base)"],
      "reply_draft": "Hi Alex,\n\nThanks for reaching out about the Staff Platform role.\n\nBefore I can evaluate further, could you share:\n\n1. Some background on Redrecruit \u2014 funding stage, engineering team size?\n2. What\u2019s the remote/hybrid policy?\n3. What does total comp look like beyond base (equity, bonus)?\n\nThanks,\nPaul",
      "draft_url": "https://mail.google.com/mail/u/0/#drafts?compose=18e4f00000000020",
      "posting_url": "",
      "email_url": "https://mail.google.com/mail/u/0/#inbox/18e4f00000000020",
      "sent": false
    },
    {
      "source": "Job Alert Listings",
      "message_id": "18e4f00000000021",
      "thread_id": "18e4f00000000021",
      "subject": "Senior / Staff Site Reliability Engineer at Radar",
      "from": "LinkedIn Job Alerts <jobalerts@linkedin.com>",
      "email_date": "2026-03-30",
      "company": "Radar",
      "role": "Senior / Staff Site Reliability Engineer",
      "location": "New York, NY",
      "verdict": "maybe",
      "reason": "SRE role at a location tech company. Comp listed at $200k\u2013$300k \u2014 within range. Unclear on company engineering quality. Indeed match.",
      "dealbreaker": "",
      "comp_assessment": "$200k\u2013$300k listed. Floor reachable. Mid-range for NYC SRE.",
      "missing_fields": ["Remote/hybrid policy", "Tech stack", "Equity details"],
      "reply_draft": "",
      "draft_url": "",
      "posting_url": "https://www.radar.com/careers/sre-12345",
      "email_url": "https://mail.google.com/mail/u/0/#inbox/18e4f00000000021",
      "sent": false
    },
    {
      "source": "Direct Outreach",
      "message_id": "18e4f00000000022",
      "thread_id": "18e4f00000000022",
      "subject": "Distinguished Engineer at Capital One",
      "from": "Jennifer Marks <jmarks@capitalone.com>",
      "email_date": "2026-04-01",
      "company": "Capital One",
      "role": "Distinguished Engineer",
      "location": "US",
      "verdict": "maybe",
      "reason": "Distinguished Engineer is a top IC track \u2014 above Staff. Capital One has a real tech org. Worth looking at comp.",
      "dealbreaker": "",
      "comp_assessment": "Capital One DE comp varies widely. Could be $300k\u2013$450k+ TC. Fintech, so cash-heavy. Verify.",
      "missing_fields": ["Comp range", "Remote/hybrid policy", "Tech stack"],
      "reply_draft": "Hi Jennifer,\n\nThanks for reaching out about the Distinguished Engineer role.\n\nI\u2019d like to learn more:\n\n1. What\u2019s the comp range for this level?\n2. What\u2019s the remote/hybrid policy?\n3. What tech stack does this team work with?\n\nBest,\nPaul",
      "draft_url": "https://mail.google.com/mail/u/0/#drafts?compose=18e4f00000000022",
      "posting_url": "",
      "email_url": "https://mail.google.com/mail/u/0/#inbox/18e4f00000000022",
      "sent": false
    },
    {
      "source": "Direct Outreach",
      "message_id": "18e4f00000000023",
      "thread_id": "18e4f00000000023",
      "subject": "Principal SRE at Barclays",
      "from": "David Walsh <dwalsh@barclays.com>",